"id","title","startYear","endYear","abstract"
700967,"Scooping Device for Aerial Forest Fire Suppressant","2016","2018","The topic of this proposal is to determine the final production model of a scooping-device that allows non-amphibious conventional airtankers to scoop water from a body of water (sea, lake, river or a dam-reservoir) flying at an altitude of \/- 10 metres, in order to suppress forest fires much more quicker by 5 times. Today only dedicated amphibious airtankers, like the so-called Canadairs CL 415, can scoop water. Non-amphibious conventional airtankers have to return to the airport to refill with loss of time. Today such a scooping device (Scodev) does not exist and it will be a revolution in forestfire combating industry, thus it is disruptive. Feasibility studies have shown that it is possible to scoop large amounts of water in very brief time of 15 seconds. Prototype flying tests will prove this ability and serve as mandatory application procedure for EASA airworthiness certification. Once the prototype tests are finished, the Scodev is ready for the market. With the patented Scodev, operators of airtankers will improve their dropping-capacity from 1 to 5 droppings per hour. By improving the dropping capacity with 5 times, the suppression-efficiency will improve exponentially up to 8 times, which means that the damage will be reduced between 50 and 80 %. Today worldwide there are only 110 amphibious Canadairs. There are 1200 non-amphibious airtankers, owned by civil protection entities or forest service bodies. In addition there are 1500 large military aircrafts for disaster relief, and 1500 small airtankers SEAT. Meaning the potential is very big and the trend is increasing due to global warming. Due to forest fires millions of hectares are lost and the financial damage is hundreds of billions of Euros. The use of the Scodev will decrease not only financial losses, but the environmental and ecological damages will also be radically reduced."
700986,"Advanced shearography kit and a robotic deployment platform for on-site inspection of wind turbine blades","2016","2018","To achieve a thorough investigation for defect presence on a wind turbine blade, close inspection is required. This implies either trained staff tied with ropes on the blade or dismantling and transferring the blade in a workshop environment. While blade dismantling is scarcely used because it requires very long downtime, human inspection also involve a relatively high delay. 
A solution to this problem is to utilize specially designed platforms that can reach the blade and implement faster inspections on site. However, current systems are not very agile or cannot reach close enough to the blade in order to use a high quality nondestructive technique. Hence, they are mostly used to carry out mere visual inspections. 
To deal with the aforementioned challenge, our team will commercialize WInspector. WInspector consists of an agile robotic platform able to climb up the wind turbine tower and deploy an advanced Digital Shearography kit that carries out the inspection of a blade at a depth of up to 50mm. 
Users of WInspector benefit through early detecting emerging defects unseen in a visual inspection performed by competing solutions, with a significantly lower downtime for the WTB, and free of dangerous human labor. 
We have tested and validated the capabilities of WInspector in relevant environment and based on feedback received by wind farm operators, including project participant Gamesa and Iberdola (who has supported us in writing for this application), we are now ready to take the next steps and complete product development allowing us to bring WInspector into the market. 
Our vision is to grow our businesses by €19.88 million in gross sales by 2023 and keep growing at 58.8% annually from 2023 onwards. Through our business growth, we will create 181 new jobs. 
It is our strong belief that the Fast Track to Innovation Pilot is the ideal financial instrument for us to accelerate the procedures required for commercialization."
701368,"We are the 1%, we stand with the 99%: reactions of high-status groups faced with social change attempts from low-status groups","2016","2018","One of the most widespread social phenomena that we witness nowadays is the emergence of collective action movements in which low-status groups mobilize in order to trigger social change (e.g. Arab Spring, Indignados, the Occupy Movement). Interest in collective action has mushroomed in the last decade, as confirmed by the fact that from the 1602 hits found in Psycarticles using the “collective action” term, more than 70% of them date from 2000 or later. However, this research is almost exclusively focused on low-status groups without taking into account high-status groups’ reactions. Existing literature on high-status groups either puts the emphasis on individual psychological processes linked to prejudice reduction or on the reinforcement of status quo. Yet, the likelihood of social change and, ultimately, the unfolding of intergroup conflict cannot be understood without considering both low-status groups’ actions and high-status groups’ reactions. This project directly targets high-status groups’ role in social change. We analyze high-status groups’ support for normative (i.e., socially accepted protest such as demonstrations) vs. nonnormative collective action behaviors (i.e., radical protest such as the use of violence).

This research project main goals are to examine: 1) psychological mechanisms explaining high-status groups’ support for normative and nonnormative collective action; 2) disentangle two theoretically contrasting perspectives by analyzing moderating conditions at different levels that lead to higher support from high-status groups in response to normative and nonnormative collective action. The main idea developed is that normative and nonnormative collective action will prove effective in eliciting high-status group support in different situations. In general, this will depend on a matching between the type of action and the individual (Question 1), the type of low-status demand (Question 2) and the socio-structural context (Question 3)."
701531,"Long-term performance simulation of geopolymer concrete under coupled carbonation and chloride transport","2016","2018","This project is aimed at long-term performance simulation of geopolymer concrete (GPC) under coupled chloride and carbonation transport. GPC has received extensive attention as an interesting alternative for ordinary cement-based concrete as a step forward to Eco-friendly construction and thus reducing the environmental impacts of conventional construction methods and materials. Geopolymer mortars are also of great interest to be used as a sustainable matrix for conservation and strengthening of existing structures. Geopolymer concrete made of fly ash and blast furnace slag binary system is the main focus of this proposal.
The project objective will be achieved through advanced multi-scale modelling and limited experimental testing. A chemo-transport framework, in which the transport and degradation are coupled at different length scales, will be implemented for the first time to simulate the micro-structural development and degradation in GPC systems since early ages. The realization of the project will be a great step forward on the current knowledge on GPC materials and of interest for both academy and industry. The project main outputs will be the developed multi-scale framework, time-dependent chloride concentration levels at reinforcing bars' surfaces as the main indicator of durability in RC structures, and design and construction guidelines for durable GPCs. 
The project will also fill the current gaps in the knowledge of the fellow. After the project, the fellow is expected to become a leader in the field of GPC materials and multi-scale modelling. Advanced training on complementary skills will also be given to the fellow to prepare him for independent excellent research and finding a permanent academic position."
701991,"A community of surface bots for creative storytelling","2016","2018","Interactive digital storytelling systems can be used to foster the development of creativity skills and enhance social awareness on our societal issues, aspects recognized to be strategic for our own future sustainability and competitiveness. However, current interactive storytelling approaches face important limitations in the implementation of digital characters. On the one hand, some systems provide very capable socially virtual agents used as characters, but enacted in a virtual world where technology is rather a barrier to effective creative thinking and collaboration. On the other hand, settings with tangible objects facilitate discussion in groups as well as the development of relevant critical social skills, but with characters unable to show advanced smart capabilities to enrich storytelling for a more effective process.
Hence, given the current state-of-the-art of technology, the main objectives of COBOTNITY are: to timely provide an affordable community of hybrid artificial agents (called surface-bots) capable of drawing a high range of digital expressions while providing tangible interaction to be used in collaborative creative storytelling; and, to provide a better understanding on how a surface-bot community can effectively be used to foster creative thinking and social awareness on societal issues. The project proposal draws on the knowledge of HMI on interaction with artificial agents (both virtual and robots) along with its expertise on interactive storytelling, as well as on the candidate’s experience on creativity in collaboration. COBOTNITY is relevant to the MSCA Work Programme because it will allow developing new research competences, ensuring advantageous skill and knowledge transfer, and opening new perspectives in diverse sectors for potential technology transfer such as entertainment, museum interaction settings and learning games."
702149,"Spatiotemporal and In-situ Spectroscopic Crystallization Studies of Microporous Materials","2016","2018","Microporous materials are crystalline, framework structures that contain pores of less than 2 nm. They commonly exhibit robust hydrothermal stability and are used in a wide range of areas including catalysis, separations, ion exchange and adsorption where their shape and size selectivity often shows superior performance over other materials. They are formed by crystallization from amorphous inorganic oxides, but the underlying mechanisms that govern the crystallization of microporous materials are poorly understood, despite extensive work in this area. This lack of understanding means that the development of new materials and compositions is an inefficient trial and error process mainly guided by heuristics. In this work I propose to study the formation principles of microporous materials through 3D spatiotemporal element mapping and monitoring the incorporation of spectroscopically active and catalytically interesting heteroatoms, namely copper and titanium, in distinct framework structures. This proposal uses two distinct approaches (ex-situ STXM and in-situ spectroscopy) to study two different inorganic chemistries (aluminophosphate and silicate) with two different spectroscopically active heteroatoms (copper and titanium) and four different microporous material frameworks (AFI, CHA, MFI and MWW) in order to probe the underlying crystallization mechanisms behind microporous material synthesis and crystallization. The unprecedented combination of 3D spatiotemporal element mapping at various stages of crystallization combined with in-situ spectroscopic studies of catalytically active elements will lead to previously unavailable information about the underlying mechanisms governing the formation of these materials. These insights will lead to innovations in synthesizing both known and novel materials and compositions."
702402,"Oscillatory long-Range Coherence in Attention","2016","2018","Attention -the ability to focus selectively on task relevant information and resist distraction- plays a critical role in many everyday life situations, such as in school or while driving. With an almost constant stream of information reaching us through smart phones and computers, our world becomes increasingly distracting, requiring enhanced attentional capabilities. This calls for new approaches to improve attention, also benefiting patients populations suffering from attention deficits. Is it possible to safely improve attention without medication? And how does the brain actually guides attention and resist distractions? The proposed research aims to answer these questions by combining a novel brain stimulation technique, transcranial alternating current stimulation (tACS) with state of the art neuroimaging methods. It will specifically test the intriguing hypothesis that attention can be enhanced by synchronizing rhythmic activity between two brain regions previously shown to be involved in attention. In the first study I will assess the effects of stimulation on attention performance, while simultaneously measuring neural activity using electroencephalogram (EEG). This will allow me to determine to what extent tACS can improve attention and investigate the causal role of neural oscillations in attention. In the second study, tACS will be combined with functional magnetic resonance imaging (fMRI) allowing to bridge the literature on neural oscillations (derived from EEG research) and attention networks (derived from fMRI research). Specifically, it will provide novel insights into the exact neural network subserving oscillatory activity associated with attention. Taken together, this project will not only investigate an innovative way to improve attention, with important implication for future clinical studies, but will also have a major contribution to cognitive neuroscience theories of attention."
702466,"Documenting Sarajevo: City and Society During and After the War","2016","2018","The aim of this architectural research is to analyses material transformations of Sarajevo—the destruction and reconstruction caused by the war (1992-1996), from documents (videos, photos, and drawings) produced by citizens. Finding these documents is important in the shared process of collective memory creation by Bosnians, but also for academic research and post-war reconstructions. For EU citizens, understanding Sarajevo citizens’ experience can help them to understand the realities of life of the actual war contexts (i.e. Syria). As a citizen who experienced the war, an architect and a researcher of the war cities, my research objective is to expand architectural research methods by focusing on how war affects the transformation of cities through a process combining architecture and media research. I will apply interdisciplinary research methods used in architecture/planning (i.e. geographic information system - GIS), media studies (i.e. video) and anthropology (i.e. interviews). To use media tools is a complement to architect research and representation (i.e. video) modes because they create documents (i.e. drawings) understandable only to architects. Research will be accessible to scientific and general public through a web platform, called Evidencity, which will include map-based, multimedia research archive. Regarding to my academic career this project contributes: obtaining academic profile in the fields of architectural research methods and media for researching of different war cities; advancing my skills as an architect (i.e. analysis of the destroyed city) for working on projects related to the post-war reconstruction. The European continent is constantly dealing with states of war, on its territories (Ukraine) or on its borders (Libya-Italy). Proposal aims to contribute using research results to create interdisciplinary guidelines for architectural research to the emerging field of urban conflict studies that will be applicable to the other war cities."
702511,"Urban networks: multidisciplinary research into the formation of early urban societies in Campania (Italy)","2016","2018","Living in cities has been one of the most transformative innovations in human history: it has heavily impacted social and political interaction between people, and has significantly changed the relationship between man and his natural environment. Understanding why people in the past started living together in cities in the first place, provides crucial tools for the study of urban life from a comparative perspective.
One of the earliest urbanised regions of Europe was Campania, in Southern Italy. The first traces of urbanisation date to the early first millennium BCE. Innovative archaeological research on urbanisation in Campania is still lacking. With the URBANet project, I propose an innovative approach to early Campanian urbanisation, informed by multidisciplinary perspectives. 
I start with the specific hypothesis that the processes underlying the formation of early urban societies in the past were social and political. At the same time, the topographical component was fundamental. Furthermore, early urban societies interacted with each other. This observation suggests, in addition, that urbanisation also rose as the result of connectivity and networks. 
I propose to verify the hypothesis with the collection and analysis of data, focusing on four selected case-studies. The innovative method combines qualitative (anthropological) methods with computed analysis (GIS and social network analysis). Training goals are set to bolster my research and project management skills. 
The expertise at the VU University in similar projects ensures the best possible institutional environment for the execution of the URBANet project."
702649,"Neighbourhood Change in a Comparative Context: a Social-Mobility Approach","2016","2018","Neighbourhood Change in a Comparative Context: a Social-Mobility Approach
For decades, scholars have been seeking to understand why and how neighbourhoods change. Integrating different strands of the literature, it is suggested that neighbourhood transitions occur due to the interaction of cyclic dynamics generated by neighbourhoods’ local contexts, and structural transformations generated by higher level contexts. The interaction and the relative roles of these processes have not been investigated so far. Because research designs used to date cannot account for both types of effect, this proposal points to comparative research in contrasting regional and national contexts as a promising direction. Key methodological issues are identified in the current state-of-the-art with regard to the possibility of conducting effective comparative research on the topic: comparability of results, conceptualization of neighborhood change and distinguishing the relative impact of processes at different levels. The proposed research aims at addressing these issues in setting up a systematic approach to comparative analysis of neighbourhood change. The approach relies on the application of methods from social mobility research which has been tackling equivalent challenges. The approach will be implemented in an empirical comparative analysis of neighbourhood change in the Netherlands and Israel."
702880,"Democratization through Education? The role of education in strengthening civil agency and voice in Sub-Saharan Africa. (Case study: Uganda)","2016","2018","EDU-DEM advances our understanding of the role of education in fostering democratization processes in sub-Saharan Africa from the bottom up. Education has been long treated as an area of development programming that is separate from strengthening civil society formation and democratization processes. We still face several knowledge gaps in existing research on how education increases the agency of the wider civil sphere. This void is striking and it is here where EDU-DEM makes an innovative contribution to existing debates. In doing so, EDU-DEM will 1) explore the correlations between educational attainment and civil society characteristics and agency; 2) assess how formal and non-formal education systems and programmes increase the attention to and comprehension of local politics; 3) identify innovative, multi-scalar and context-specific approaches to nurture democratization processes through education.
EDU-DEM brings together the disciplines of education and international development while drawing from and contributing to research on democratization, civil society and agency. Uganda serves as a case study as it exemplifies a striking paradox occurring in the majority of sub-Saharan African states. Despite a steady increase of funds and the commitment to support development through the grassroots level, experts witness weak democratization processes on the ground. Leading local CSOs consist of a small group of well-funded, urban-based organisations, led by a highly educated elite, with only a token presence in rural areas. On the other hand, the majority of grassroots and less-visible civil society actors are frequently characterized by political illiteracy –not to mention the country’s poorly educated wider civil sphere. 
The findings of this project will be published in a monograph, two journal articles, policy briefs and publicized to a non-specialized audience via outreach activities (e.g.: dedicated website, media and blog articles, round-table discussions)."
703071,"Muslims condemning violent extremism - An interdisciplinary analysis of public initiatives in the Netherlands and Norway 2001-2015","2016","2018","The project comprehends an interdisciplinary study on the dilemma faced by Muslims whether or not to explicitly disavow violent extremism. It explores how Muslim organisations and youth groups in the Netherlands and Norway have responded to calls to publicly condemn violent extremism. Special attention is paid to how young Muslim women and men have used specific strategies to gain media coverage, and the gendered aspects of these strategies. The project aims to analyse recent historical developments in the two countries in theoretical and empirical depth, by studying public debates and specific public initiatives undertaken by Muslims in the aftermath of the 9/11 attacks in 2001, the murder of Theo van Gogh in the Netherlands in 2004, and the 22/7 attacks by Anders Behring Breivik in Norway in 2011. It combines a comparative historical approach with theory and methodology of religious-, media-, cultural- and gender studies. The project fills an important gap in the growing body of research on Muslims in Europe: a lot of scholarly attention is paid to public discourses that stigmatise Muslims, but far less on how people with a Muslim background confirm or subvert dominant images in their interactions with the media. Scholars have described the pressure that young Muslims perceive to explicitly disavow terrorism, but a thorough analysis of their responses has yet to be made. The project will contribute to the understanding of the mechanisms of social cohesion in contemporary European society at a time of growing global threats. Hosting arrangements at the Department of Philosophy and Religious Studies at Utrecht University guarantee excellent training and research facilities. The vibrant interdisciplinary research network at the Department and the intense supervision by the awarded professor of religious studies Birgit Meyer will greatly contribute to the project and strengthen the interdisciplinary knowledge, skills and research network of the Experienced Researcher."
703141,"BEyond Willpower: InterTemporal CHoice Improved through NudginG","2016","2018","Many decisions involve intertemporal choice: a choice between options whose consequences occur at different points in time. For example, choosing whether or not to eat cake when you also want to lose weight this month. Remarkably, we often choose small immediate rewards (e.g. eat cake) over large future benefits (e.g. lose weight), despite different intentions. How can we become better at resisting temptations and align our behavior with our long-term intentions? ‘Nudging’, a concept from behavioral economics, appears a promising strategy: by designing choice contexts that exploit our cognitive biases, it gently guides us into making choices that are better for ourselves and society. One way to nudge intertemporal choice is by ‘framing’ the timing of the choice outcome in a certain way: e.g. we make more patient choices when future outcomes are described in terms of calendar dates (‘on May 1’) than in terms of corresponding delays (‘in 30 days’). However, two problems hamper the use of time framing in practice: we do not know how time framing works nor who is susceptible to it. If we do not address these problems, we will not understand our seemingly irrational choices and we will not be able to develop framing interventions that change behavior. To solve these problems, I will determine the mechanisms and individual determinants of time framing in intertemporal choice, using new computational models, functional MRI, and an online experiment. My working hypothesis is that time framing changes how we perceive time and that individual differences in time perception determine whether or not time framing changes behavior. The proposed research will provide scientists, policymakers, clinicians, and businesses with a deep understanding of how framing influences our choices. This knowledge will guide smart policies, personalized interventions, and nudge-based technologies that promote future-minded behavior and reduce societal costs in Europe and the rest of the world."
